<?xml version="1.0" encoding="UTF-8"?>
<gelCAN:deaths xmlns:vc="http://www.w3.org/2007/XMLSchema-versioning"
 xmlns:gelCAN="https://genomicsengland.co.uk/xsd/cancer/2.0.0"
 xmlns:xsi="http://www.w3.org/2001/XMLSchema-instance"
 xsi:schemaLocation="https://genomicsengland.co.uk/xsd/cancer/2.0.0 file:/Users/genomicsengland/Documents/Cancer/MainProgrammeCancer/Cancer%20Schemas%20v2.0.0%20FINAL/DeathsCancer-v2.0.0.xsd">
    <gelCAN:metadata>
        <gelCAN:schema-name>DeathsCancer</gelCAN:schema-name>
        <gelCAN:schema-version>2.0.0</gelCAN:schema-version>
        <gelCAN:date>2006-05-04</gelCAN:date>
        <gelCAN:source-organisation>source-organisation0</gelCAN:source-organisation>
        <gelCAN:source-system>source-system0</gelCAN:source-system>
        <gelCAN:local-report-id>local-report-id0</gelCAN:local-report-id>
    </gelCAN:metadata>
    <gelCAN:subject>
        <gelCAN:participant-identifiers>
            <gelCAN:participant-id>participant-id0</gelCAN:participant-id>
            <gelCAN:date-of-birth>2006-05-04</gelCAN:date-of-birth>
            <gelCAN:nhs-number>0000000000</gelCAN:nhs-number>
            <gelCAN:chi-number>chi-number0</gelCAN:chi-number>
            <gelCAN:surname>surname0</gelCAN:surname>
            <gelCAN:forenames>forenames0</gelCAN:forenames>
        </gelCAN:participant-identifiers>
        <gelCAN:death>
            <gelCAN:event-details>
                <gelCAN:event-date>2006-05-04T18:13:51.0</gelCAN:event-date>
                <gelCAN:event-reference>event-reference0</gelCAN:event-reference>
            </gelCAN:event-details>
            <gelCAN:related-cancer-diagnoses>
                <gelCAN:related-cancer-diagnosis-icd>related-cancer-diagnosis-icd0</gelCAN:related-cancer-diagnosis-icd>
                <gelCAN:related-cancer-diagnosis-icd>related-cancer-diagnosis-icd1</gelCAN:related-cancer-diagnosis-icd>
                <gelCAN:related-cancer-diagnosis-snomedct>related-cancer-diagnosis-snomedct0</gelCAN:related-cancer-diagnosis-snomedct>
                <gelCAN:related-cancer-diagnosis-snomedct>related-cancer-diagnosis-snomedct1</gelCAN:related-cancer-diagnosis-snomedct>
            </gelCAN:related-cancer-diagnoses>
            <gelCAN:death-location>3</gelCAN:death-location>
            <gelCAN:significant>significant0</gelCAN:significant>
            <gelCAN:condition>condition0</gelCAN:condition>
            <gelCAN:immediate-cause>immediate-cause0</gelCAN:immediate-cause>
            <gelCAN:underlying-cause>underlying-cause0</gelCAN:underlying-cause>
        </gelCAN:death>
    </gelCAN:subject>
    <gelCAN:subject>
        <gelCAN:participant-identifiers>
            <gelCAN:participant-id>participant-id1</gelCAN:participant-id>
            <gelCAN:date-of-birth>2006-05-04</gelCAN:date-of-birth>
            <gelCAN:nhs-number>0000000000</gelCAN:nhs-number>
            <gelCAN:chi-number>chi-number1</gelCAN:chi-number>
            <gelCAN:surname>surname1</gelCAN:surname>
            <gelCAN:forenames>forenames1</gelCAN:forenames>
        </gelCAN:participant-identifiers>
        <gelCAN:death>
            <gelCAN:event-details>
                <gelCAN:event-date>2006-05-04T18:13:51.0</gelCAN:event-date>
                <gelCAN:event-reference>event-reference1</gelCAN:event-reference>
            </gelCAN:event-details>
            <gelCAN:related-cancer-diagnoses>
                <gelCAN:related-cancer-diagnosis-icd>related-cancer-diagnosis-icd2</gelCAN:related-cancer-diagnosis-icd>
                <gelCAN:related-cancer-diagnosis-icd>related-cancer-diagnosis-icd3</gelCAN:related-cancer-diagnosis-icd>
                <gelCAN:related-cancer-diagnosis-snomedct>related-cancer-diagnosis-snomedct2</gelCAN:related-cancer-diagnosis-snomedct>
                <gelCAN:related-cancer-diagnosis-snomedct>related-cancer-diagnosis-snomedct3</gelCAN:related-cancer-diagnosis-snomedct>
            </gelCAN:related-cancer-diagnoses>
            <gelCAN:death-location>3</gelCAN:death-location>
            <gelCAN:significant>significant1</gelCAN:significant>
            <gelCAN:condition>condition1</gelCAN:condition>
            <gelCAN:immediate-cause>immediate-cause1</gelCAN:immediate-cause>
            <gelCAN:underlying-cause>underlying-cause1</gelCAN:underlying-cause>
        </gelCAN:death>
    </gelCAN:subject>
</gelCAN:deaths>
